video_id,comment,published_at
e4CjU8gw-BQ,"Wait , Bu Retno masih Menlu kaan ??",2025-09-10T08:15:23Z
e4CjU8gw-BQ,😢😢😢,2025-09-10T08:04:14Z
iJuu32iVuXg,Nga MUNDUR pak ? KETAUAN PERGI LARI SIDNEY MARATHON sewaktu DEMO kemarin?,2025-09-10T08:04:29Z
iJuu32iVuXg,LC yg dimaksud di sini singkatan dari li ve chat : ngobrol/diskusi/debat (misalnya di tempat seperti ini) tapi terus menerus di antara dua orang atau lebih hingga boroskan masa/waktu.,2025-09-10T07:59:12Z
wPmni-jdfLo,"Gk ada beda nya klu gini. Mungkin  lebih parah,  cukai gk naik gimna. Pajak gila""an ,  pikir ada perubahan, ternyata ??  Mungkin org pinter di indonesia. Kalah dengan org yg ada uang,  😢😢",2025-09-10T07:24:34Z
